{
  "items": [
    {"id": "SC-1", "status": "pass", "evidence": "SYNTHETIC: python -m py_compile app/main.py; exit=0; stdout is empty.", "reason": "The application module compiles."},
    {"id": "SC-2", "status": "pass", "evidence": "SYNTHETIC: contract SC-2 command; exit=0; stdout=health response verified\\n.", "reason": "Status and full JSON match."},
    {"id": "SC-3", "status": "pass", "evidence": "SYNTHETIC: python -m pytest -q tests/test_health.py; exit=0; stdout includes 1 passed.", "reason": "The new test passes."},
    {"id": "SC-4", "status": "pass", "evidence": "SYNTHETIC llm_judge: before/after diff for app/main.py and tests/test_health.py reviewed.", "reason": "Existing routes and dependencies are preserved; the new test checks status and full JSON."}
  ],
  "overall": "pass",
  "reinstruct_message": null,
  "attempt": 2
}
